{
  "meta": {
    "company_name": "锦浪科技股份有限公司",
    "company_short": "锦浪",
    "anchor_date": "2026-10-19",
    "contract_version": "v0.1",
    "sample_version": "v0.3",
    "search_hint": "输入关键词，如：储能、锦浪云、募投、毛利率……"
  },

  "overview": {
    "lead": "锦浪是全球第三大光伏逆变器厂商（2022–2024 连续三年，Wood Mackenzie 口径），靠“逆变器＋分布式电站发电”赚钱；储能逆变器 2025 年 +185.31% 接棒并网成为第一大产品，2026H1 海外收入占比升至 60.3%。16.77 亿可转债募投明确投向数智化（0.99 亿）、上海研发中心（2.48 亿）与两条智能化产线——对 IT 供应商而言，最明确的切入点是建设期内的未来工厂数智化与研发、云平台扩容。",
    "basic_info": [
      { "label": "公司全称", "value_html": "锦浪科技股份有限公司（曾用名：宁波锦浪新能源科技股份有限公司）", "sources": ["E1"] },
      { "label": "官网", "value_html": "www.ginlong.com；海外品牌 Solis", "sources": ["E23"] },
      { "label": "成立时间", "value_html": "2005-09-09（前身宁波锦浪新能源科技有限公司，初始注册资本 150 万元）", "sources": ["E1"] },
      { "label": "注册地／经营地", "value_html": "浙江省宁波市象山县经济开发区滨海工业园金通路 57 号（注册地与主要经营地一致）", "sources": ["E1"] },
      { "label": "所有制／资本状态", "value_html": "民营；上市（2019-03-19 深交所创业板，300763）", "sources": ["E1"] },
      { "label": "高管背景", "value_html": "王一鸣，1981 年生，上海交通大学信息工程专业本科、英国爱丁堡大学电子与电信硕士，国家特聘专家、教授级高级工程师；2005 年创立公司并任董事长兼总经理至今——技术背景创始人全程主导经营", "sources": ["E2"] },
      { "label": "员工规模", "value_html": "4,755 人（2025 年报期末：母公司 3,968＋主要子公司 787），其中研发人员 1,032 人占 21.7%。实控人家族合计持股约 45.8%（王一鸣 29.73%、王峻适 8.47%、林伊蓓 7.62%，聚合页时点口径）", "sources": ["E3", "E29"] },
      { "label": "组织结构", "value_html": "董事长／总经理：王一鸣；副总经理／财务总监：郭俊强；副总经理／董事会秘书：张婵；副总经理：陆荷峰（2026-05 业绩说明会口径，名单与年报一致，无窗口内变动）", "sources": ["E18", "E28"] }
    ],
    "business": {
      "heading": { "title": "业务与竞争力", "id": "s1-biz", "nav": "业务与竞争力" },
      "outline_title": "业务轮廓（三层，按价值创造逻辑）：",
      "outline_items": [
        { "text_html": "① 光伏逆变器（主营，收入占比 66.6%）——组串式并网＋储能逆变器研发、生产、销售与服务，客户为 EPC 承包商、系统集成商、安装商、电站投资业主四类；2025 年销量 79.02 万台、收入 46.28 亿元、毛利率 26.88%、产能 175 万台/年；2022–2024 连续三年全球出货量第 3 位（2024 年约占全球 589GW 的 5%）。主营成熟期，内部结构剧变（储能接棒并网，见财务数据表2）。", "sources": ["E3", "E13"] },
        { "text_html": "② 分布式光伏发电（主营，占比约 29%）——全资子公司锦浪智慧运营：工商业电站持有发电（2025 年收入 5.87 亿）＋户用光伏系统服务（14.44 亿），截至 2025 年末累计并网 4,818.09MW；2025 年出售电站 239.06MW、户用系统当年未新增——存量资产转向轻资产运营。毛利率 50%+ 的现金流型业务，提供稳定现金与利润支撑。", "sources": ["E3"] },
        { "text_html": "③ 储能系统（培育→放量）——2025 下半年切入、全年收入 1.48 亿“从无到有”；2026Q2 单季确认约 1.4 亿、户储占比超 60%；管理层目标 2027 年户储配套率 50% 以上。", "sources": ["E15", "E17"] }
      ],
      "chain": [
        { "label": "产业链位置", "label_bold": true, "text_html": "中游电力电子设备制造。", "sources": [] },
        { "label": "上游：", "label_bold": false, "text_html": "电子元器件（直接材料占营业成本 84.4%）——功率器件（IGBT/SiC）等，国产化推进中，三安光电 SiC 器件已向锦浪批量交付，无卡脖子管制风险披露。", "sources": ["E26"] },
        { "label": "下游：", "label_bold": false, "text_html": "EPC 承包商、系统集成商、安装商、电站投资业主，分散、无单一客户依赖；海外经销为主，2025 年海外收入 34.62 亿、占比 49.79%，2026H1 升至 60.3%；直接受各国光伏政策与关税影响（美国 2019 年起加征 25% 关税，2025 年起“对等关税”叠加）。", "sources": ["E3", "E6", "E9"] },
        { "label": "合规面：", "label_bold": false, "text_html": "2025 年法律意见书核查口径，无重大诉讼/处罚。", "sources": ["E30"] }
      ],
      "strengths_title": "核心竞争力：",
      "strength_items": [
        { "text_html": "① 技术自研——产品已迭代至第七代平台，主持/参与国家及行业标准 40 余项（两项国标第一起草单位）；建有国家企业技术中心、院士专家工作站、博士后工作站；研发人员 1,032 人（＋19.4%）、研发投入 5.08 亿元（＋32.05%，占营收 7.3%）。", "sources": ["E3"] },
        { "text_html": "② 品牌与认证——Solis/锦浪双品牌；全球第一家获得 PVEL 可靠性测试报告的逆变器企业，连续十年获 EuPD“顶级光伏逆变器品牌”（2016–2025）。", "sources": ["E3"] },
        { "text_html": "③ 全球渠道——100+ 国家销售，欧洲/澳洲/东南亚/美国/拉美本地化服务网络。", "sources": ["E3", "E23"] },
        { "text_html": "④ 制造——175 万台/年产能＋浙江省未来工厂试点（数字化智能制造，见 3.0 机制二）。", "sources": ["E3", "E24"] }
      ],
      "moat": [
        { "label": "护城河：", "text_html": "认证与可靠性构成主要结构性壁垒——逆变器设计寿命要求 20 年以上，主流市场准入认证（欧盟 CE、澳 SAA、美 ETL、PVEL 可靠性）周期长、转换成本高；全球渠道与十年品牌积累次之。", "sources": [] },
        { "label": "短板（如实写）：", "text_html": "行业价格竞争激烈，逆变器毛利率从 2022 年 28.88% 降至 2024 年 20.14%（2025 年回升至 26.88%）；规模与阳光电源、华为存在量级差距。结论：存在以认证/可靠性/渠道为核心的结构性壁垒，宽度中等。", "sources": ["E12", "E3"] }
      ]
    },
    "financial": {
      "lead_note": "口径说明：上市公司经审计年报为主锚（合并报表口径）；2026H1 为半年报、未经审计，单独标注。",
      "blocks": [
        {
          "type": "table",
          "caption": "表1｜主锚财务指标（2022–2025，合并报表，经审计年报）",
          "header": ["指标（亿元）", "2022", "2023", "2024", "2025"],
          "rows": [
            ["营业收入", "58.90", "61.01", "65.42", "69.52"],
            ["营收同比", "＋77.7%", "＋3.59%", "＋7.23%", "＋6.26%"],
            ["归母净利润", "10.60", "7.79", "6.91", "7.43"],
            ["归母同比", "＋123.7%", "－26.4%", "－11.32%", "＋7.53%"],
            ["扣非归母净利", "10.45", "7.86", "6.37", "6.88"],
            ["经营活动现金流净额", "未披露*", "3.83", "20.51", "22.03"],
            ["研发投入（费用口径）", "2.99", "3.12", "3.84", "5.08"],
            ["研发投入占营收", "5.1%", "5.1%", "5.9%", "7.3%"]
          ],
          "note": "* 2022 年经营现金流本次未获取数值，未予估算。数据来源：2023–2025 年报（经审计）。",
          "caption_sources": ["E3", "E4", "E5"]
        },
        {
          "type": "chart_bar",
          "caption": "图1｜营业收入与归母净利润（亿元，2022–2025）",
          "categories": ["2022", "2023", "2024", "2025"],
          "series": [
            { "name": "营业收入", "unit": "亿元", "color": "blue", "values": [58.90, 61.01, 65.42, 69.52] },
            { "name": "归母净利润", "unit": "亿元", "color": "orange", "values": [10.60, 7.79, 6.91, 7.43] }
          ],
          "chart_note": "营收三年复合约 5.7%；归母净利 2023–2024 连续下滑后 2025 年回升（＋7.53%）。"
        },
        {
          "type": "table",
          "caption": "表2｜分部结构演进（营业收入，亿元）",
          "header": ["分部", "2022", "2023", "2024", "2025", "2026H1（半年）"],
          "rows": [
            ["并网逆变器", "40.03", "40.64", "37.92（－6.7%）", "29.96（－20.98%）", "10.56（－41.99%）"],
            ["储能逆变器", "10.68", "4.39（－58.9%）", "5.72（＋30.4%）", "16.32（＋185.31%）", "16.40（＋106.7%）"],
            ["户用光伏发电系统", "5.79", "11.94", "14.64（＋22.7%）", "14.44（－1.3%）", "6.64（－17.8%）"],
            ["新能源电力生产", "1.35", "0.93", "6.17（＋111%）", "5.87", "2.55（－16.0%）"],
            ["储能系统", "—", "—", "—", "1.48（新增）", "Q2 单季约 1.4"]
          ],
          "note": "",
          "caption_sources": ["E3", "E4", "E5", "E6"]
        },
        {
          "type": "table",
          "caption": "表3｜毛利率两口径对照（均如实列示，不混用）",
          "header": ["口径", "2022", "2023", "2024", "2025", "2026H1"],
          "rows": [
            ["审核问询函还原口径·综合", "33.52%", "32.38%", "31.78%", "未披露", "光伏行业口径 35.10%（同比微降）"],
            ["还原口径·逆变器业务", "28.88%", "23.14%", "20.14%", "未披露", "未披露"],
            ["年报口径·储能逆变器", "—", "—", "—", "31.75%（＋4.27pct）", "33.16%"],
            ["年报口径·并网逆变器", "—", "—", "—", "24.22%（＋5.54pct）", "30.45%"]
          ],
          "note": "综合毛利率与逆变器毛利率两口径并存（质保金是否计入营业成本），不混用；2025 全年综合毛利率年报精确值本次未获取，以分产品口径代替，不影响判断。行业中位数：同细分赛道 5 家上市公司 2025 年综合毛利率中位数约 31–33%（样本含阳光电源、德业股份、固德威、上能电气、禾迈股份，来源混合、口径不完全一致，仅供参考）。",
          "caption_sources": ["E3", "E12", "E6"],
          "note_sources": ["E19", "E20"]
        },
        {
          "type": "timeline",
          "caption": "图2｜融资历史时间线（2019 年上市以来五项，合计约 67.6 亿元）",
          "nodes": [
            { "value": "5.33 亿", "date": "2019-03", "who": "IPO（创业板）", "sources": ["E25"] },
            { "value": "7.24 亿", "date": "2020", "who": "定向增发", "sources": ["E25"] },
            { "value": "8.97 亿", "date": "2022", "who": "可转债（锦浪转债）", "sources": ["E25"] },
            { "value": "29.25 亿", "date": "2022", "who": "定向增发", "sources": ["E25"] },
            { "value": "16.77 亿", "date": "2025-10", "who": "可转债“锦浪转02”", "sources": ["E8"] }
          ],
          "timeline_note": "锦浪转02 募投六项目：分布式光伏电站 3.54 亿、高电压大功率并网逆变器产线 3.33 亿、中大功率混合式储能逆变器产线 2.91 亿、上海研发中心 2.48 亿、<b>数智化提升项目 0.99 亿</b>、补充流动资金 3.51 亿；两条新产线均明确配置智能生产、智能检测、智能仓储与智能搬运系统。上市后累计现金分红 7.40 亿元（截至 2026H1）；锦浪转02 转股价 2026-09 公告预计触发向下修正条件。",
          "caption_sources": ["E25", "E8", "E9", "E10", "E16"],
          "note_sources": ["E9", "E16", "E10"]
        },
        {
          "type": "text",
          "caption": "最新动向（未经审计，标注披露时点）",
          "caption_sources": ["E6", "E14", "E15", "E22"],
          "blocks": [
            { "text_html": "2026H1：营收 38.82 亿（＋2.32%）；归母净利 4.23 亿（－29.74%）；研发投入 2.56 亿（＋19.0%）；毛利率 35.10%。利润下滑三因素（公司业绩预告口径）：汇兑损失约 4,794 万元；2026 年限制性股票激励每月分摊股份支付约 1,897 万元；天气因素致发电小时数下降。季度节奏：Q1 归母约 0.6 亿（同比近七成降幅），Q2 环比大幅修复（+491.68%）。2026 三季报截至锚点日尚未披露（法定截止 10 月 31 日）。", "sources": ["E6", "E14", "E15", "E22", "E7"] }
          ]
        }
      ]
    }
  },

  "signals": {
    "lead": "过去 18 个月五件值得重点看的事：储能逆变器接棒并网成为第一大产品、16.77 亿可转债募投落地（数智化＋研发中心＋两条智能产线）、业绩 Q1 降七成而 Q2 环比修复近五倍（非现金因素为主）、美国 FCC 逆变器禁令落地成为行业级合规变量、股权激励绑定营收复合 15% 的增长考核。",
    "key": [
      {
        "id": "sig1", "nav": "储能接棒并网",
        "title": "重点信号 S1｜储能逆变器爆发，接棒并网成为第一大产品",
        "sections": [
          { "label": "事实依据", "text_html": "储能逆变器收入 2024 年 5.72 亿 → 2025 年 16.32 亿（＋185.31%）、占比 23.47%、毛利率 31.75%（＋4.27pct）；2026H1 收入 16.40 亿（＋106.7%）、占比 42.24%，反超并网（27.19%）成为第一大产品。工商业储能逆变器月接单超 4,000 套、户储逆变器月接单达 10 万台（公司业绩交流口径）。", "sources": ["E3", "E17", "E6"] },
          { "label": "为什么重要", "text_html": "光储融合下储能逆变器是技术溢价最高的产品线（公司交流口径：工商业储能逆变器毛利率约 40–50%）；接单量倍增意味着研发测试任务、产线负载与售后接入量同步放大。", "sources": ["E17"] },
          { "label": "对关注方向的影响", "text_html": "储能相关的研发测试环境（机制一）、新产线（机制二）与全球设备接入（机制四）三条链路负载都在放大，是 D1/D2/D3 的核心佐证。", "sources": [] }
        ]
      },
      {
        "id": "sig2", "nav": "募投落地",
        "title": "重点信号 S2｜16.77 亿可转债募投落地，数智化与研发中心进入建设期",
        "sections": [
          { "label": "事实依据", "text_html": "“锦浪转02”2025-10-17 发行、11-06 上市，募投六项目中含数智化提升项目（拟投 0.99 亿）、上海研发中心建设项目（拟投 2.48 亿）及两条智能化新产线（均明确配置自动生产设备、智能检测设备、智能仓储系统、智能搬运系统）。年报自述打造“锦浪光储逆变器未来工厂”，集成应用 SCADA 等工业控制系统及工业软件，实现“生产制造自动化、生产过程控制闭环化、物流控制精准化、生产指挥可视化、设计制造运营一体化”。", "sources": ["E8", "E9", "E3", "E24"] },
          { "label": "为什么重要", "text_html": "募投即资本开支的公开承诺，建设期 2 年（至约 2027）——IT 相关投入（智能仓储/搬运/检测、数智化、研发中心）进入可跟进窗口。", "sources": [] },
          { "label": "对关注方向的影响", "text_html": "时点与金额均明确（募集说明书与年报等一手资料），是全部方向中证据最硬的一类；切入点为未来工厂与募投项目建设话题（D1/D2）。", "sources": [] }
        ]
      },
      {
        "id": "sig3", "nav": "业绩波动",
        "title": "重点信号 S3｜业绩短期剧烈波动：Q1 利润降七成、Q2 环比修复近五倍",
        "sections": [